,Food Code,Food Name,Description,Group,Previous,Main data references,Footnote,Energy (kJ),Energy (kcal),Fat (g),Saturates (g),Carbohydrate (g),Sugars (g),Starch (g),Fibre (g),Protein (g),Salt (g),Super Group
2517,11-903,"Semolina, raw","6 samples, 5 products",AA,11-024 ,Nutrient survey of flours and grains 2005,,1482,349,1.6,0.23,70.7,0.5,70.3,2.9,11.6,0,Cereals and cereal products
2438,11-955,"Sandwich, white bread, bacon, lettuce and tomato",Recipe from University of North London survey of commercial sandwiches,AB,11-563 ,University of North London 1997. Recalculated in 2013,,973,233,11.9,2.46,21.9,2.2,19.7,1.5,8.7,1.19,Cereals and cereal products
2534,11-802,Shortbread,"10 samples, 7 products",AM,11-523 ,"DH, Nutrient analysis of biscuits, buns, cakes and pastries, 2011",,2162,517,29.0,17.45,57.1,14.9,42.3,2.2,5.9,0.8,Cereals and cereal products
2509,11-544,"Scotch pancakes, retail","6 samples, 4 brands",AP,11-270 50-148 ,"LGC, Nutrient analysis of bread and morning goods, 1999",,1160,276,9.6,0.74,40.2,20.6,19.5,1.9,6.3,1.05,Cereals and cereal products
2621,11-919,"Strudel, fruit filled, retail, frozen","12 samples, 7 products",AS,,"ADAS Laboratories, Nutrient analysis of ice creams and desserts, 1999",,1060,254,13.5,5.02,27.3,10.5,16.7,5.4,3.0,N,Cereals and cereal products
2622,17-371,"Stuffing mix, dried","10 samples, 4 brands; assorted flavours",AT,50-178 ,"Miscellaneous Foods Supplement, 1994",,1458,345,5.2,2.4,61.4,4.3,57.1,6.8,9.9,3.65,Cereals and cereal products
2582,13-521,"Spinach, baby, raw","16 samples, autumn and winter, UK grown and imported",DG,,"DH, Nutrient analysis of fruit and vegetables, 2013",,78,19,0.6,0.08,0.2,0,0.2,1,2.6,0.08,Vegetables
2639,13-359,"Swede, flesh only, raw",Peeled thinly,DG,50-819 ,"IFR, The nutritional composition of retail vegetables in the UK, 1984-1987; Vitamin K1 from Bolton-Smith et al, Br.J. Nutr 83, 2000",,131,31,0.3,0,5,4.9,0.1,2.9,0.7,0.04,Vegetables
2644,13-672,"Sweet potato, baked",Literature sources and calculation from raw,DG,13-363,"Vegetables, Herbs and Spices Supplement, 1991",,529,125,0.4,0.2,26.1,13.9,12.2,5.2,1.6,0.13,Vegetables
2651,13-529,"Sweetcorn kernels, canned in water, drained","12 samples, 8 brands, no added salt or sugar",DG,13-459 ,"DH, Nutrient analysis of fruit and vegetables, 2013",,356,85,1.7,0.27,13,7.2,5.6,3.1,2.6,0,Vegetables
2658,13-622,"Sweetcorn, kernels, raw",IFR; removed from cob,DG,13-368 ,"Vegetables, Herbs and Spices Supplement, 1991; and calculated from 13-508",,275,66,1.8,0.2,7.5,2,5.4,2.3,3.4,0,Vegetables
2402,15-872,"Salad, pasta, vegetables and mayonnaise",Recipe from dietary survey records,DR,15-590 ,Updated 2014,,639,153,7.9,0.76,15.9,1.9,14,1.4,3.9,0.06,Vegetables
2528,15-883,"Shepherd's pie, vegetable",Recipe. Vegetable and lentil base with potato topping. Recipe from review of recipe collection,DR,15-602 ,Updated 2014,,482,115,3.9,0.3,14.2,1.5,12.7,2.4,4.6,0.01,Vegetables
2637,15-617,"Sushi, vegetable","10 samples, 9 products",DR,,"Direct Laboratories, Nutrient analysis catch up project, 2003",,631,149,1.3,N,30.2,6.8,23.3,1.6,3.4,1.3,Vegetables
2605,14-059,Star fruit,Carambola. Analysis and literature sources; ends trimmed,FA,,"Fruit and Nuts Supplement, 1992",,182,43,0.3,0.1,7.2,7.1,0.2,2.8,0.5,0.01,Fruit
2620,14-324,"Strawberries, raw","19 samples, summer and autumn, UK grown and imported, including Elsanta, Sonata, Ava, Portola and unspecified varieties",FA,14-260 ,"DH, Nutrient analysis of fruit and vegetables, 2013",,178,42,0.5,0.04,6.1,6.1,0,3.8,0.6,0,Fruit
2633,14-845,Sunflower seeds,Analysis and literature sources,GA,50-995 14-859 ,"Reviewed 2013. LGC, Fatty acid composition of foods, 1987; and Fruit and Nuts Supplement, 1992",,2513,606,47.5,6.58,17,1.6,14.8,8.6,23.4,0.01,Nuts and seeds
2393,13-852,Saffron,Literature sources,H,,"Marsh et al. (1977) Composition of foods: spices and herbs, raw, processed and prepared, Agriculture Handbook No. 8-2",,1489,353,5.9,1.59,61.5,44.1,17.4,3.9,11.4,0.38,Herbs and spices
2394,13-854,"Sage, dried, ground",Literature souces,H,50-850 ,"Marsh et al. (1977) Composition of foods: spices and herbs, raw, processed and prepared, Agriculture Handbook No. 8-2",,1549,372,12.7,7,38.8,1.7,37.1,29.9,10.6,0.03,Herbs and spices
2530,17-236,"Sherry, medium","15-19.5% ABV. 8 samples; including Spanish, British, Cyprus, own label",QF,50-1115 ,"Reviewed 2013. LGC, Alcoholic beverages, soft drinks and tea and coffee survey, 1983-1984. Additional data from 50-1115",,488,117,0.0,0,5.9,5.9,0,0,0.1,0.07,Alcoholic beverages
2587,17-247,"Spirits, 40% volume","Mean of brandy, gin, rum, whisky and vodka",QK,50-1122 ,"Reviewed 2013. MW5, 1991. Vitamin K1 from Bolton-Smith et al Br.J. Nutr. 83, 2000. Additional data from 50-1122",,919,222,0.0,0,0,0,0,0,0.0,0,Alcoholic beverages
2628,17-060,"Sugar, brown",3 samples,SC,,"Reviewed 2013. LGC, Analysis of assorted foods, 1994",,1642,386,0.0,0,96.5,96.5,0,0,0.1,0.08,"Sugars, preserves and snacks"
2630,17-062,"Sugar, icing",Analysis and maunfacturers' data,SC,,"Miscellaneous Foods Supplement, 1994",,1698,399,0.0,0,99.9,98.9,1,0,0.0,0.03,"Sugars, preserves and snacks"
2631,17-063,"Sugar, white",Granulated and loaf sugar,SC,50-1011 ,"Reviewed 2013. LGC, Analysis of assorted foods, 1994",,1700,400,0.0,0,100,100,0,0,0.0,0.01,"Sugars, preserves and snacks"
2666,17-065,"Syrup, golden",3 samples of the same brand,SC,50-1012 ,"Reviewed 2013. LGC, Analysis of assorted foods, 1994",,1320,311,0.0,0,77.3,77.3,0,0,0.3,0.68,"Sugars, preserves and snacks"
2544,17-096,Smartie-type sweets,10 samples including Smarties and M & M's,SEA,50-1023 ,"Reviewed 2013. LGC, Analytical survey of confectionery items, 1992",,N,N,17.5,10.4,70.3,67.4,2.8,N,5.4,0.15,"Sugars, preserves and snacks"
2566,17-711,"Soup, minestrone, canned",Label data,WA,17-542 ,"Industry data, 2013",,139,33,0.2,0.1,6.2,1.8,4.4,0.9,1.1,0.5,"Soups, sauces and miscellaneous foods"
2555,17-695,"Soup, chicken, cream of, canned","10 cans, 3 brands",WAC,17-250 ,"MW5, 1991; and industry data, 2013",,240,58,3.8,0.6,4.1,1.1,3.1,0,1.7,0.6,"Soups, sauces and miscellaneous foods"
2557,17-652,"Soup, cream of tomato, canned","10 samples, 5 brands",WAC,17-278 ,"DH, Nutrient analysis of a range of processed foods with particular reference to trans fatty acids, 2013",,222,53,2.0,0.27,7.6,5.4,2.2,0.6,0.9,0.61,"Soups, sauces and miscellaneous foods"
2563,17-698,"Soup, lentil, canned","10 cans, 4 brands",WAC,17-263 ,"LFRA, Nutrient analysis of miscellaneous foods, 1992; and industry data, 2013",,203,48,0.2,N,7.8,1.2,6.6,1.2,3.1,0.5,"Soups, sauces and miscellaneous foods"
2571,17-700,"Soup, oxtail, canned","10 cans, 3 brands",WAC,17-272 ,"MW4, 1978; and industry data, 2013",,184,44,1.7,0.6,4.7,0.9,3.8,0.1,2.4,0.55,"Soups, sauces and miscellaneous foods"
2575,17-712,"Soup, vegetable, canned","10 cans, 3 brands",WAC,17-284 ,"LFRA, Nutrient analysis of miscellaneous foods, 1992; and industry data, 2013",,175,42,0.6,N,6.9,2.5,4.4,1.5,1.4,0.58,"Soups, sauces and miscellaneous foods"
2561,17-653,"Soup, instant, dried, as purchased","11 samples, 3 brands, powder only, not including croutons",WAE,17-507 ,"DH, Nutrient analysis of a range of processed foods with particular reference to trans fatty acids, 2013",,1652,393,13.4,8.7,59.5,16.8,26.5,5.6,5.9,5.94,"Soups, sauces and miscellaneous foods"
2453,17-628,"Sauce, Chinese cook in, sweet & sour","10 samples, 7 products, chilled and ambient",WC,,"Direct Laboratories, Nutrient analysis catch up project, 2003; and industry data, 2013",,414,98,1.0,0,21.3,18.8,2.5,0.8,0.5,0.63,"Soups, sauces and miscellaneous foods"
2454,17-629,"Sauce, Chinese stir fry","10 samples, 10 products, including black bean and Szechuan, chilled and ambient",WC,,"Direct Laboratories, Nutrient analysis catch up project, 2003; and industry data, 2013",,405,96,1.3,0.12,19.2,16.2,2.9,0.9,1.4,1.43,"Soups, sauces and miscellaneous foods"
2397,17-703,Salad cream,"3 samples, different brands",WCG,17-512 ,"LGC, Dairy products and eggs, 1989; and industry data, 2013. Vitamin E from Milk Marketing Board, 1992 'Fat, Fatty acids and vitamin E content of a selection of biscuits, cakes and desserts'.",,1359,328,26.7,2,20.2,16.1,4.1,0.5,1.4,1.75,"Soups, sauces and miscellaneous foods"
2470,17-336,"Sauce, sweet and sour, take-away","7 samples purchased from Chinese restaurants, sundry-style dipping sauce",WCN,,"LFRA, Nutrient analysis of miscellaneous foods, 1992",,N,N,3.4,N,31.9,27.1,4.8,N,0.2,0.38,"Soups, sauces and miscellaneous foods"
2577,17-721,"Soy sauce, light and dark varieties","8 samples, 4 brands",WCN,17-334 ,"LFRA, Nutrient analysis of miscellaneous foods, 1992; and industry data, 2013",,345,81,0.0,0,17.3,15.9,1.4,0,3.0,13.75,"Soups, sauces and miscellaneous foods"
2432,17-367,Salt,"2 samples, table salt",WY,50-1184 ,"Reviewed 2013. LGC, Analysis of assorted foods, 1994",,0,0,0.0,0,0,0,0,0,0.0,98.25,"Soups, sauces and miscellaneous foods"
2613,17-515,"Stock cubes, beef","10 samples, 6 brands including Bovril, Oxo and own brands",WY,17-368 17-476 50-1182 ,"Reviewed 2013. RHM Technology, Nutrient analysis of selected foods, 1995; and Fatty Acid Supplement, 1998 (17-478)",,1162,276,9.2,3.51,30.5,1.8,28.7,0,17.8,36.4,"Soups, sauces and miscellaneous foods"
2617,17-680,Stock gel,"Including stock pots, stock melts and squeezy tubes",WY,,"Industry data, 2013",,698,166,3.6,1.74,25.7,5.6,20.1,1.8,6.7,16.13,"Soups, sauces and miscellaneous foods"
2618,17-681,"Stock, chicken, ready made, retail",Label data,WY,,"Industry data, 2013",,52,12,0.2,0.1,0.2,0.1,0.1,0.3,2.3,0.56,"Soups, sauces and miscellaneous foods"
